{
  "schemaVersion": 1,
  "groupId": "rec28ldfRTiDpi",
  "slug": "oddyouth",
  "events": [
    {
      "id": "e-oddyouth-official-debut",
      "groupId": "rec28ldfRTiDpi",
      "eventType": "debut",
      "title": "以首张单曲《Best Friendz》正式出道",
      "summary": "11月4日原报道直接确认1日已正式发行出道单曲并出道。",
      "scopeNote": "沿用原正式出道候选ID，Best Friendz与THAT’S ME同一载体；广播首舞台、品牌MV、未核实体商品日均不混作音乐实际日。",
      "eventDate": {
        "value": "2024-11-01",
        "precision": "day"
      },
      "announcementDate": null,
      "plannedDate": null,
      "status": "confirmed",
      "importance": "major",
      "memberIds": [],
      "workIds": [
        "rec28ldfRTrGY0",
        "rec28ldfRTrH26"
      ],
      "releaseKey": "oddyouth:best-friendz",
      "relatedEventIds": [],
      "sources": [
        {
          "id": "es-a12175a14a103152",
          "url": "https://www.genie.co.kr/magazine/subMain?ctid=1&mgz_seq=14758",
          "publisher": "Genie Magazine / ODD YOUTH原始推广专题",
          "title": "ODD YOUTH出道单曲Best Friendz",
          "sourcePublishedAt": null,
          "checkedAt": "2026-10-16",
          "scopeNote": "推广原句支持Best Friendz出道单曲性质及两曲名，目录支持标注日期；二者不自动证明团体正式出道实际日期。",
          "evidenceRef": "evidence/inherited/E02/task05/sources/batch-e--task05--sources--oddyouth-best-feature.json"
        },
        {
          "id": "es-44c20170dff02cc7",
          "url": "https://itopgroup.com/shop/item.php?it_id=1787708551",
          "publisher": "TOP MEDIA",
          "title": "TOP MEDIA ODD YOUTH官方专辑列表",
          "sourcePublishedAt": null,
          "checkedAt": "2026-10-16",
          "scopeNote": "推广原句支持Best Friendz出道单曲性质及两曲名，目录支持标注日期；二者不自动证明团体正式出道实际日期。",
          "evidenceRef": "evidence/inherited/E02/task05/sources/batch-e--task05--sources--oddyouth-top-albums.json"
        },
        {
          "id": "es-9fd6c4878faa38ce",
          "url": "https://www.topstarmall.com/goods/goods_view.php?goodsNo=1000000196",
          "publisher": "TOP STAR MALL / TOP MEDIA官方单曲商品资料",
          "title": "Batch B accepted catalogue evidence: oddyouth",
          "sourcePublishedAt": null,
          "checkedAt": "2026-10-16",
          "scopeNote": "推广原句支持Best Friendz出道单曲性质及两曲名，目录支持标注日期；二者不自动证明团体正式出道实际日期。",
          "evidenceRef": "evidence/inherited/E02/task05/sources/batch-e--task05--sources--reused--oddyouth-best-catalogue.json"
        },
        {
          "id": "fs05-oddyouth-debut",
          "url": "https://www.xportsnews.com/article/1925307",
          "publisher": "엑스포츠뉴스 / 장인영",
          "title": "오드유스, '인기가요' 데뷔 무대 화제…입덕 유발 비주얼+퍼포먼스",
          "sourcePublishedAt": {
            "value": "2024-11-04",
            "precision": "day"
          },
          "checkedAt": "2026-10-16",
          "scopeNote": "11月4日专业媒体正文完整过去式：1日已正式发行出道单曲并出道；另段确认两曲而非两次发行，不把11月3日广播首舞台当正式出道日。",
          "evidenceRef": "evidence/task05/evidence/oddyouth-debut.json"
        }
      ],
      "reviewStatus": "ready",
      "holdReasons": []
    },
    {
      "id": "e-oddyouth-i-like-you-ep",
      "groupId": "rec28ldfRTiDpi",
      "eventType": "release",
      "title": "发行首张迷你专辑《I Like You》",
      "summary": "原始推广专题明确已携首迷你专辑回归，官方公司专辑表与旧收据均给2025年4月15日。",
      "scopeNote": "整张5曲合一事件；保留真实已有作品ID，不把其他曲创造ID。",
      "eventDate": {
        "value": "2025-04-15",
        "precision": "day"
      },
      "announcementDate": null,
      "plannedDate": null,
      "status": "confirmed",
      "importance": "major",
      "memberIds": [],
      "workIds": [
        "rec28ldfRTrH5P"
      ],
      "releaseKey": "oddyouth:i-like-you",
      "relatedEventIds": [],
      "sources": [
        {
          "id": "es-0a850ddf9681efe6",
          "url": "https://www.genie.co.kr/magazine/subMain?ctid=1&mgz_seq=15162",
          "publisher": "Genie Magazine / ODD YOUTH原始推广专题",
          "title": "ODD YOUTH I Like You原始发行专题",
          "sourcePublishedAt": null,
          "checkedAt": "2026-10-16",
          "scopeNote": "实际回归原文，不将每首曲或MV拆成发行事件。",
          "evidenceRef": "evidence/E/task05/sources/oddyouth-ilike-feature.json"
        },
        {
          "id": "es-44c20170dff02cc7",
          "url": "https://itopgroup.com/shop/item.php?it_id=1787708551",
          "publisher": "TOP MEDIA",
          "title": "TOP MEDIA ODD YOUTH官方专辑列表",
          "sourcePublishedAt": null,
          "checkedAt": "2026-10-16",
          "scopeNote": "日期索引仅用于音源/专辑，不认定商品上架日或MV首发日；不用无标签生日数字。",
          "evidenceRef": "evidence/E/task05/sources/oddyouth-top-albums.json"
        },
        {
          "id": "es-2c40ebf08565be68",
          "url": "https://music.bugs.co.kr/album/20719304",
          "publisher": "Bugs",
          "title": "ODD YOUTH 1st MINI ALBUM [I Like You] — Bugs",
          "sourcePublishedAt": null,
          "checkedAt": "2026-10-16",
          "scopeNote": "复用D原始成功收据；目录日期单独不成为实际发行。若与本轮原始实际发行正文合用，逐事件说明。",
          "evidenceRef": "evidence/E/task05/sources/reused/oddyouth-ilike-catalogue.json"
        }
      ],
      "reviewStatus": "ready",
      "holdReasons": []
    },
    {
      "id": "e-oddyouth-babyface-single",
      "groupId": "rec28ldfRTiDpi",
      "eventType": "release",
      "title": "发行第二张单曲《Babyface》",
      "summary": "原始团体推广问候确认已回归，官方公司专辑列表给2026年3月12日。",
      "scopeNote": "无对应公开作品ID，workIds=[]；不占用Best Friendz等旧记录。",
      "eventDate": {
        "value": "2026-03-12",
        "precision": "day"
      },
      "announcementDate": null,
      "plannedDate": null,
      "status": "confirmed",
      "importance": "major",
      "memberIds": [],
      "workIds": [],
      "releaseKey": "oddyouth:babyface",
      "relatedEventIds": [],
      "sources": [
        {
          "id": "es-3b293c1e45a9c5ab",
          "url": "https://www.genie.co.kr/magazine/subMain?ctid=1&mgz_seq=15980&pg=1",
          "publisher": "Genie Magazine / ODD YOUTH原始推广专题",
          "title": "ODD YOUTH Babyface原始回归专题",
          "sourcePublishedAt": null,
          "checkedAt": "2026-10-16",
          "scopeNote": "仅发行载体，未映射新作品业务ID。",
          "evidenceRef": "evidence/E/task05/sources/oddyouth-babyface-feature.json"
        },
        {
          "id": "es-44c20170dff02cc7",
          "url": "https://itopgroup.com/shop/item.php?it_id=1787708551",
          "publisher": "TOP MEDIA",
          "title": "TOP MEDIA ODD YOUTH官方专辑列表",
          "sourcePublishedAt": null,
          "checkedAt": "2026-10-16",
          "scopeNote": "日期索引仅用于音源/专辑，不认定商品上架日或MV首发日；不用无标签生日数字。",
          "evidenceRef": "evidence/E/task05/sources/oddyouth-top-albums.json"
        },
        {
          "id": "es-83a7aaba14c9d280",
          "url": "https://www.genie.co.kr/detail/artistInfo?xxnm=82691143",
          "publisher": "Genie",
          "title": "ODD YOUTH专题日期索引",
          "sourcePublishedAt": null,
          "checkedAt": "2026-10-16",
          "scopeNote": "明确排除该页AI biography；索引独立不确立发行事实。",
          "evidenceRef": "evidence/E/task05/sources/oddyouth-genie-index.json"
        }
      ],
      "reviewStatus": "ready",
      "holdReasons": []
    },
    {
      "id": "e-oddyouth-cant-go-back-single",
      "groupId": "rec28ldfRTiDpi",
      "eventType": "release",
      "title": "发行第三张单曲《can’t go back》",
      "summary": "原始团体推广专题确认第三单曲回归，官方公司自家专辑列表给2026年8月19日。",
      "scopeNote": "音乐发行日期；公司Multimedia列表另列8月26日MV条目，不能覆盖音源发行日。",
      "eventDate": {
        "value": "2026-08-19",
        "precision": "day"
      },
      "announcementDate": null,
      "plannedDate": null,
      "status": "confirmed",
      "importance": "major",
      "memberIds": [],
      "workIds": [],
      "releaseKey": "oddyouth:cant-go-back",
      "relatedEventIds": [],
      "sources": [
        {
          "id": "es-42073fdd2e1c4d97",
          "url": "https://genie.co.kr/magazine/subMain?ctid=1&mgz_seq=16364",
          "publisher": "Genie Magazine / ODD YOUTH原始推广专题",
          "title": "ODD YOUTH can't go back原始回归专题",
          "sourcePublishedAt": null,
          "checkedAt": "2026-10-16",
          "scopeNote": "与TOP公司自家专辑日期2026-08-19交叉；公司MV列表的8月26日不覆盖音源日期。",
          "evidenceRef": "evidence/E/task05/sources/oddyouth-cantgoback-feature.json"
        },
        {
          "id": "es-44c20170dff02cc7",
          "url": "https://itopgroup.com/shop/item.php?it_id=1787708551",
          "publisher": "TOP MEDIA",
          "title": "TOP MEDIA ODD YOUTH官方专辑列表",
          "sourcePublishedAt": null,
          "checkedAt": "2026-10-16",
          "scopeNote": "日期索引仅用于音源/专辑，不认定商品上架日或MV首发日；不用无标签生日数字。",
          "evidenceRef": "evidence/E/task05/sources/oddyouth-top-albums.json"
        }
      ],
      "reviewStatus": "ready",
      "holdReasons": []
    }
  ],
  "gaps": [
    "官方专辑表和艺人原始推广正文共同支持四个发行阶段；新Babyface/can’t go back无公开workId，留空。",
    "公司Multimedia的can’t go back MV8月26日与音源8月19日不同，不混用。",
    "Best Friendz品牌MV预公开、11月1日音源/出道、11月7日实体载体分开，不新增重复首发卡。",
    "成员加入、退出、解散与公司变化未取得直接声明；无标签生日数字不做任何事件日期。",
    "Babyface、can’t go back暂无公开真实workId，保持空关联；8月26日MV不覆盖8月19日音源日。",
    "普通英语改版列排除清单，可由dot按产品偏好另选展示；不代表不存在。"
  ]
}
